[
  {"id": "rf-nsaid-use", "code": "RF_nsaid_use", "label": "NSAID use", "entity_type": "risk_factor", "category": "medication", "specialty_tags": ["gastroenterology", "general"], "schema_version": 1, "revision": 1, "status": "active"},
  {"id": "rf-anticoagulation", "code": "RF_anticoagulation", "label": "Anticoagulation", "entity_type": "risk_factor", "category": "medication", "specialty_tags": ["cardiology", "gastroenterology", "emergency"], "schema_version": 1, "revision": 1, "status": "active"},
  {"id": "rf-alcohol-use", "code": "RF_alcohol_use", "label": "Alcohol use", "entity_type": "risk_factor", "category": "social", "specialty_tags": ["hepatology", "general", "psychiatry"], "schema_version": 1, "revision": 1, "status": "active"},
  {"id": "rf-smoking", "code": "RF_smoking", "label": "Tobacco smoking", "entity_type": "risk_factor", "category": "social", "specialty_tags": ["pulmonology", "cardiology", "general", "oncology"], "schema_version": 1, "revision": 1, "status": "active"},
  {"id": "rf-travel", "code": "RF_recent_travel", "label": "Recent travel", "entity_type": "risk_factor", "category": "exposure", "specialty_tags": ["infectious_disease", "gastroenterology"], "schema_version": 1, "revision": 1, "status": "active"},
  {"id": "rf-food-exposure", "code": "RF_food_exposure", "label": "Suspect food/water exposure", "entity_type": "risk_factor", "category": "exposure", "specialty_tags": ["infectious_disease", "gastroenterology"], "schema_version": 1, "revision": 1, "status": "active"},
  {"id": "rf-prior-ulcer", "code": "RF_prior_ulcer", "label": "Prior peptic ulcer disease", "entity_type": "risk_factor", "category": "past_medical", "specialty_tags": ["gastroenterology"], "schema_version": 1, "revision": 1, "status": "active"},
  {"id": "rf-liver-disease", "code": "RF_known_liver_disease", "label": "Known chronic liver disease", "entity_type": "risk_factor", "category": "past_medical", "specialty_tags": ["hepatology"], "schema_version": 1, "revision": 1, "status": "active"},
  {"id": "rf-gallstones", "code": "RF_known_gallstones", "label": "Known gallstones", "entity_type": "risk_factor", "category": "past_medical", "specialty_tags": ["gastroenterology", "surgery"], "schema_version": 1, "revision": 1, "status": "active"},
  {"id": "rf-family-gi-cancer", "code": "RF_family_gi_cancer", "label": "Family history of GI cancer", "entity_type": "risk_factor", "category": "family", "specialty_tags": ["gastroenterology", "oncology"], "schema_version": 1, "revision": 1, "status": "active"},
  {"id": "rf-immunosuppression", "code": "RF_immunosuppression", "label": "Immunosuppression", "entity_type": "risk_factor", "category": "past_medical", "specialty_tags": ["infectious_disease", "general"], "schema_version": 1, "revision": 1, "status": "active"},
  {"id": "rf-pregnancy", "code": "RF_pregnancy", "label": "Pregnancy", "entity_type": "risk_factor", "category": "physiologic", "specialty_tags": ["obstetrics", "general", "emergency"], "schema_version": 1, "revision": 1, "status": "active"}
]
