[
  {"id": "ix-cbc", "code": "IX_cbc", "label": "Complete blood count", "entity_type": "investigation", "category": "laboratory", "specialty_tags": ["general"], "schema_version": 1, "revision": 1, "status": "active"},
  {"id": "ix-cmp", "code": "IX_basic_metabolic_panel", "label": "Basic / comprehensive metabolic panel", "entity_type": "investigation", "category": "laboratory", "specialty_tags": ["general"], "schema_version": 1, "revision": 1, "status": "active"},
  {"id": "ix-lft", "code": "IX_liver_panel", "label": "Liver biochemistries", "entity_type": "investigation", "category": "laboratory", "specialty_tags": ["hepatology", "gastroenterology"], "schema_version": 1, "revision": 1, "status": "active"},
  {"id": "ix-lipase", "code": "IX_lipase", "label": "Serum lipase", "entity_type": "investigation", "category": "laboratory", "specialty_tags": ["gastroenterology", "emergency"], "schema_version": 1, "revision": 1, "status": "active"},
  {"id": "ix-amylase", "code": "IX_amylase", "label": "Serum amylase", "entity_type": "investigation", "category": "laboratory", "specialty_tags": ["gastroenterology"], "schema_version": 1, "revision": 1, "status": "active"},
  {"id": "ix-troponin", "code": "IX_troponin", "label": "Troponin", "entity_type": "investigation", "category": "laboratory", "specialty_tags": ["cardiology", "emergency"], "schema_version": 1, "revision": 1, "status": "active"},
  {"id": "ix-ecg", "code": "IX_ecg", "label": "ECG", "entity_type": "investigation", "category": "cardiac", "specialty_tags": ["cardiology", "emergency"], "schema_version": 1, "revision": 1, "status": "active"},
  {"id": "ix-cxr", "code": "IX_chest_xray", "label": "Chest radiograph", "entity_type": "investigation", "category": "imaging", "specialty_tags": ["pulmonology", "emergency"], "schema_version": 1, "revision": 1, "status": "active"},
  {"id": "ix-us-abdomen", "code": "IX_abdominal_ultrasound", "label": "Abdominal ultrasound", "entity_type": "investigation", "category": "imaging", "specialty_tags": ["gastroenterology", "radiology"], "schema_version": 1, "revision": 1, "status": "active"},
  {"id": "ix-ct-abdomen", "code": "IX_ct_abdomen", "label": "CT abdomen/pelvis", "entity_type": "investigation", "category": "imaging", "specialty_tags": ["surgery", "emergency", "gastroenterology"], "schema_version": 1, "revision": 1, "status": "active"},
  {"id": "ix-egd", "code": "IX_upper_endoscopy", "label": "Upper endoscopy (EGD)", "entity_type": "investigation", "category": "endoscopy", "specialty_tags": ["gastroenterology"], "schema_version": 1, "revision": 1, "status": "active"},
  {"id": "ix-colonoscopy", "code": "IX_colonoscopy", "label": "Colonoscopy", "entity_type": "investigation", "category": "endoscopy", "specialty_tags": ["gastroenterology"], "schema_version": 1, "revision": 1, "status": "active"},
  {"id": "ix-stool-studies", "code": "IX_stool_studies", "label": "Stool studies", "entity_type": "investigation", "category": "laboratory", "specialty_tags": ["gastroenterology", "infectious_disease"], "schema_version": 1, "revision": 1, "status": "active"},
  {"id": "ix-hbsag", "code": "IX_hepatitis_serologies", "label": "Hepatitis serologies", "entity_type": "investigation", "category": "laboratory", "specialty_tags": ["hepatology"], "schema_version": 1, "revision": 1, "status": "active"},
  {"id": "ix-coags", "code": "IX_coagulation_panel", "label": "Coagulation panel", "entity_type": "investigation", "category": "laboratory", "specialty_tags": ["hematology", "hepatology", "emergency"], "schema_version": 1, "revision": 1, "status": "active"}
]
